{
    "name": "quote",
    "quotation": "Lorem ipsum dolor sit amet, consectetur adipisicing elit. Odio explicabo natus officiis corporis neque laudantium quae animi minima mollitia inventore exercitationem, illum architecto voluptatibus voluptas cum, nemo incidunt vel laborum.",
    "attribution_name": "John Smith",
    "attribution_title": "President"
}

